[
  {
    "schemaVersion": 1,
    "characterId": "npc-brannoc-hale",
    "displayName": "布兰诺克・黑尔",
    "avatar": {
      "id": "428873fe4b09bd92c4dd48872aa4fb1a4fb2ede73d996d56fb9cded6b37e1085",
      "mime": "image/webp",
      "size": 253090
    },
    "sprite": {
      "id": "428873fe4b09bd92c4dd48872aa4fb1a4fb2ede73d996d56fb9cded6b37e1085",
      "mime": "image/webp",
      "size": 253090
    },
    "visuals": {
      "defaultVariant": "default",
      "variants": [
        {
          "id": "default",
          "outfit": "default",
          "expression": "neutral",
          "pose": "default",
          "sprite": {
            "id": "428873fe4b09bd92c4dd48872aa4fb1a4fb2ede73d996d56fb9cded6b37e1085",
            "mime": "image/webp",
            "size": 253090
          }
        }
      ]
    }
  },
  {
    "schemaVersion": 1,
    "characterId": "npc-sister-wren",
    "displayName": "雷恩修女",
    "avatar": {
      "id": "d82a011e51874679b30aca352c04843bff328072a681bed62fb8d15ebe47b78d",
      "mime": "image/webp",
      "size": 207048
    },
    "sprite": {
      "id": "d82a011e51874679b30aca352c04843bff328072a681bed62fb8d15ebe47b78d",
      "mime": "image/webp",
      "size": 207048
    },
    "visuals": {
      "defaultVariant": "default",
      "variants": [
        {
          "id": "default",
          "outfit": "default",
          "expression": "neutral",
          "pose": "default",
          "sprite": {
            "id": "d82a011e51874679b30aca352c04843bff328072a681bed62fb8d15ebe47b78d",
            "mime": "image/webp",
            "size": 207048
          }
        }
      ]
    }
  },
  {
    "schemaVersion": 1,
    "characterId": "npc-mirelle-voss",
    "displayName": "梅瑞尔・沃斯",
    "avatar": {
      "id": "af3cff242c65488530ea3e9ae38a035482286b2a9b902a290c921292da93f84c",
      "mime": "image/webp",
      "size": 218426
    },
    "sprite": {
      "id": "af3cff242c65488530ea3e9ae38a035482286b2a9b902a290c921292da93f84c",
      "mime": "image/webp",
      "size": 218426
    },
    "visuals": {
      "defaultVariant": "default",
      "variants": [
        {
          "id": "default",
          "outfit": "default",
          "expression": "neutral",
          "pose": "default",
          "sprite": {
            "id": "af3cff242c65488530ea3e9ae38a035482286b2a9b902a290c921292da93f84c",
            "mime": "image/webp",
            "size": 218426
          }
        }
      ]
    }
  },
  {
    "schemaVersion": 1,
    "characterId": "npc-aldous-penn",
    "displayName": "阿尔多斯・潘恩",
    "avatar": {
      "id": "e8247469c5859b14ef05fbe05070f3ba86edd0d24fe0b2413d921b6b8628a90f",
      "mime": "image/webp",
      "size": 160134
    },
    "sprite": {
      "id": "e8247469c5859b14ef05fbe05070f3ba86edd0d24fe0b2413d921b6b8628a90f",
      "mime": "image/webp",
      "size": 160134
    },
    "visuals": {
      "defaultVariant": "default",
      "variants": [
        {
          "id": "default",
          "outfit": "default",
          "expression": "neutral",
          "pose": "default",
          "sprite": {
            "id": "e8247469c5859b14ef05fbe05070f3ba86edd0d24fe0b2413d921b6b8628a90f",
            "mime": "image/webp",
            "size": 160134
          }
        }
      ]
    }
  },
  {
    "schemaVersion": 1,
    "characterId": "npc-keeper-ysolde",
    "displayName": "守灯人伊索德",
    "avatar": {
      "id": "1c9ecd45bd164d00d494af3b6a4a388f30ff00ce05995607a41f09786a19396a",
      "mime": "image/webp",
      "size": 279508
    },
    "sprite": {
      "id": "1c9ecd45bd164d00d494af3b6a4a388f30ff00ce05995607a41f09786a19396a",
      "mime": "image/webp",
      "size": 279508
    },
    "visuals": {
      "defaultVariant": "default",
      "variants": [
        {
          "id": "default",
          "outfit": "default",
          "expression": "neutral",
          "pose": "default",
          "sprite": {
            "id": "1c9ecd45bd164d00d494af3b6a4a388f30ff00ce05995607a41f09786a19396a",
            "mime": "image/webp",
            "size": 279508
          }
        }
      ]
    }
  },
  {
    "schemaVersion": 1,
    "characterId": "npc-corvin-ashe",
    "displayName": "科尔文・艾什",
    "avatar": {
      "id": "84c6731ccf82448606b98af7481d00beaed5607da7ff800302b4263f6fc34710",
      "mime": "image/webp",
      "size": 175186
    },
    "sprite": {
      "id": "84c6731ccf82448606b98af7481d00beaed5607da7ff800302b4263f6fc34710",
      "mime": "image/webp",
      "size": 175186
    },
    "visuals": {
      "defaultVariant": "default",
      "variants": [
        {
          "id": "default",
          "outfit": "default",
          "expression": "neutral",
          "pose": "default",
          "sprite": {
            "id": "84c6731ccf82448606b98af7481d00beaed5607da7ff800302b4263f6fc34710",
            "mime": "image/webp",
            "size": 175186
          }
        }
      ]
    }
  }
]
