[
  {
    "schemaVersion": 1,
    "characterId": "npc-tomas-reed",
    "displayName": "Tomas Reed",
    "avatar": {
      "id": "34ef4bafbc15ace6d16f9a5ed8c34d255b005e696860c9bcdf4cb4d5ff1b90e8",
      "mime": "image/webp",
      "size": 559546
    },
    "sprite": {
      "id": "34ef4bafbc15ace6d16f9a5ed8c34d255b005e696860c9bcdf4cb4d5ff1b90e8",
      "mime": "image/webp",
      "size": 559546
    },
    "visuals": {
      "defaultVariant": "default",
      "variants": [
        {
          "id": "default",
          "outfit": "default",
          "expression": "neutral",
          "pose": "default",
          "sprite": {
            "id": "34ef4bafbc15ace6d16f9a5ed8c34d255b005e696860c9bcdf4cb4d5ff1b90e8",
            "mime": "image/webp",
            "size": 559546
          }
        }
      ]
    }
  },
  {
    "schemaVersion": 1,
    "characterId": "npc-june-okafor",
    "displayName": "June Okafor",
    "avatar": {
      "id": "de5cc941e8b69b213061876f10e1d2319532a5c3e1caca722b96622b59acb4e4",
      "mime": "image/webp",
      "size": 449644
    },
    "sprite": {
      "id": "de5cc941e8b69b213061876f10e1d2319532a5c3e1caca722b96622b59acb4e4",
      "mime": "image/webp",
      "size": 449644
    },
    "visuals": {
      "defaultVariant": "default",
      "variants": [
        {
          "id": "default",
          "outfit": "default",
          "expression": "neutral",
          "pose": "default",
          "sprite": {
            "id": "de5cc941e8b69b213061876f10e1d2319532a5c3e1caca722b96622b59acb4e4",
            "mime": "image/webp",
            "size": 449644
          }
        }
      ]
    }
  },
  {
    "schemaVersion": 1,
    "characterId": "npc-mina-park",
    "displayName": "Dr. Mina Park",
    "avatar": {
      "id": "4647f07e4a345689ae6509dc8f23f3319299b4b27c5de04bf652567c9e9b8ec2",
      "mime": "image/webp",
      "size": 371452
    },
    "sprite": {
      "id": "4647f07e4a345689ae6509dc8f23f3319299b4b27c5de04bf652567c9e9b8ec2",
      "mime": "image/webp",
      "size": 371452
    },
    "visuals": {
      "defaultVariant": "default",
      "variants": [
        {
          "id": "default",
          "outfit": "default",
          "expression": "neutral",
          "pose": "default",
          "sprite": {
            "id": "4647f07e4a345689ae6509dc8f23f3319299b4b27c5de04bf652567c9e9b8ec2",
            "mime": "image/webp",
            "size": 371452
          }
        }
      ]
    }
  },
  {
    "schemaVersion": 1,
    "characterId": "npc-priya-nair",
    "displayName": "Priya Nair",
    "avatar": {
      "id": "12279ac10003312b0e3f9a6be29c0e9a092c82d75fac2535d3f26d57a71a4bed",
      "mime": "image/webp",
      "size": 300328
    },
    "sprite": {
      "id": "12279ac10003312b0e3f9a6be29c0e9a092c82d75fac2535d3f26d57a71a4bed",
      "mime": "image/webp",
      "size": 300328
    },
    "visuals": {
      "defaultVariant": "default",
      "variants": [
        {
          "id": "default",
          "outfit": "default",
          "expression": "neutral",
          "pose": "default",
          "sprite": {
            "id": "12279ac10003312b0e3f9a6be29c0e9a092c82d75fac2535d3f26d57a71a4bed",
            "mime": "image/webp",
            "size": 300328
          }
        }
      ]
    }
  },
  {
    "schemaVersion": 1,
    "characterId": "npc-eli-varga",
    "displayName": "Eli Varga",
    "avatar": {
      "id": "b451f73be719fd7ec230c9c9c88474f3cd4ff2b9d37ff3c422d68d3a106b06d9",
      "mime": "image/webp",
      "size": 490606
    },
    "sprite": {
      "id": "b451f73be719fd7ec230c9c9c88474f3cd4ff2b9d37ff3c422d68d3a106b06d9",
      "mime": "image/webp",
      "size": 490606
    },
    "visuals": {
      "defaultVariant": "default",
      "variants": [
        {
          "id": "default",
          "outfit": "default",
          "expression": "neutral",
          "pose": "default",
          "sprite": {
            "id": "b451f73be719fd7ec230c9c9c88474f3cd4ff2b9d37ff3c422d68d3a106b06d9",
            "mime": "image/webp",
            "size": 490606
          }
        }
      ]
    }
  }
]
